{
  "version": 1,
  "language": "zh-CN",
  "theme": "swiss",
  "section_order": ["experience", "projects", "education", "skills", "awards"],
  "filename": "周宁_AI产品经理_旧版兼容测试",
  "target": {"role": "AI 产品经理", "company_type": "互联网"},
  "basics": {
    "name": "周宁",
    "headline": "AI 产品经理｜需求分析 · 原型验证",
    "phone": "138-0000-1357",
    "email": "zhou.ning@example.com",
    "location": "上海",
    "summary": "围绕真实业务问题完成需求拆解、原型设计和试用验证。",
    "links": [],
    "photo": {"enabled": false, "source": null}
  },
  "education": [{"school": "东海大学（合成测试）", "degree": "本科", "major": "信息管理", "start": "2021.09", "end": "2025.06"}],
  "experience": [{
    "organization": "澄明科技（合成测试）", "role": "产品运营实习生", "start": "2024.07", "end": "2024.12",
    "bullets": [{"text": "访谈 6 名客服并定义检索与引用流程，完成客服知识助手内部试用。", "evidence_type": "user_confirmed", "source_note": "合成测试数据"}]
  }],
  "projects": [],
  "skills": [{"category": "产品", "items": ["需求分析", "原型设计"]}],
  "awards": []
}
